{"apiVersion":"policy.antaeus.io/v0alpha1","kind":"Policy","metadata":{"description":"Route vendor submissions according to review policy.","name":"vendor-onboarding"},"spec":{"defaultOutcome":"review","rules":[{"description":"Deny services in a prohibited category.","id":"prohibited-service","outcome":"deny","when":"The submitted service belongs to a prohibited category."},{"description":"Allow a complete submission with no material risk indicators.","id":"complete-low-risk-submission","outcome":"allow","when":"The submission is complete and contains no material risk indicators."}]}}
